{"run":46,"commit":"lazysql","metric":4704.8,"metrics":{},"status":"checks_failed","description":"Lazy SQLite backend registration improved TUI help startup but persistence core tests reported failures.","timestamp":1778162706897,"segment":2,"confidence":10.89153108051731,"asi":{"hypothesis":"SQLite extension discovery eagerly loads heavy Hikari/Flyway/SQLite implementation. Registering a lightweight extension descriptor and teaching the persistence facade to require backend namespaces on first delegated DB call should cut startup while preserving DB behavior.","rollback_reason":"Although startup improved to 4704.8ms and lint passed, `clojure -M:test -n com.blockether.vis.ext.persistance-sqlite.core-test` reported 3 failures, including multiprocess migration/open tests and an attestation persistence test. Need inspect whether tests assume manifest requires the implementation namespace or whether lazy resolution missed child-process registration.","next_action_hint":"Reapply lazy SQLite registration, then run only the failing persistence tests with full Lazytest output; check child process commands for explicit require/discovery assumptions and ensure `resolve-impl` requires backend ns in both normal and optional delegate paths.","startup_ms_observed":4704.8,"failure_classes":["persistence_multiprocess_tests","persistence_attestation_test"]}}
{"run":47,"commit":"lazysql","metric":4685.2,"metrics":{},"status":"checks_failed","description":"Lazy SQLite registration retry still failed persistence core tests despite backend direct-require registration.","timestamp":1778162866896,"segment":2,"confidence":10.10723964382502,"asi":{"hypothesis":"Adding direct backend registration in the heavy SQLite implementation namespace should preserve tests/old embedders while manifest discovery uses a lightweight register namespace.","rollback_reason":"Startup improved to 4685.2ms, but the same 3 persistence core tests still reported failures. Direct require registration did not address the failing paths; likely the failures are either flaky multiprocess tests exposed by this run or assumptions unrelated to simple backend registration.","next_action_hint":"Do not keep until the failing persistence tests are understood. If revisiting, capture child process output in expect-child-success! or run the failing test body manually after lazy registration to see the exact exit/error.","startup_ms_observed":4685.2,"failure_classes":["persistence_multiprocess_tests","persistence_attestation_test"]}}
{"run":48,"commit":"6d8a240","metric":5197.9,"metrics":{},"status":"keep","description":"Defer foundation doctor and reproduction CLI namespaces until their commands run.","timestamp":1778162981776,"segment":2,"confidence":10.842511472674174,"asi":{"hypothesis":"Foundation aggregator loads doctor and transcript/reproduction namespaces at extension discovery only to build CLI command maps. Static command descriptors with lazy run-fn wrappers and lazy doctor-check-fn should reduce TUI/Vis startup without removing commands.","verification":["VIS_CRAC=0 VIS_MEASURE=1 bin/vis channels tui --help","clojure -M:test -n com.blockether.vis.ext.foundation.core-test","clojure -M:test -n com.blockether.vis.ext.foundation.doctor-test","./verify.sh --quick"],"result":"TUI command help improved slightly from 5221.4ms to 5197.9ms. Small improvement; bigger remaining cost is cold Clojure process plus foundation/introspection/editing load.","not_overfit_reason":"This benefits any startup that discovers extensions but does not run `vis extensions doctor` or `vis extensions reproduction`; command behavior is preserved via lazy wrappers."}}
{"run":49,"commit":"lightte","metric":5312.6,"metrics":{},"status":"checks_failed","description":"Lightweight Telegram channel registration failed lint due unused private legacy subcommands fn.","timestamp":1778163079433,"segment":2,"confidence":11.75463591135231,"asi":{"hypothesis":"Telegram bot namespace is loaded during every extension discovery but is irrelevant to TUI startup. Splitting lightweight channel registration from the heavy long-poll bot should reduce TUI/Vis startup and preserve Telegram behavior via lazy command wrappers.","rollback_reason":"./verify.sh --quick failed on clj-kondo unused private var `telegram-channel-subcommands` after moving registration out of bot.clj. Startup also measured worse than current best (5312.6ms vs 5197.9ms), so no reason to keep this attempt as-is.","next_action_hint":"If retrying, remove or publicize the unused `telegram-channel-subcommands` function in bot.clj and rerun. But improvement may be below noise because bot require is only ~45ms.","startup_ms_observed":5312.6}}
{"run":50,"commit":"fasthel","metric":4093.1,"metrics":{},"status":"checks_failed","description":"Generic fast help dispatch attempt cut TUI help startup but failed formatting parse gate.","timestamp":1778163224822,"segment":2,"confidence":10.842511472674174,"asi":{"hypothesis":"Any `--help`/`-h` command should first try dispatch against already-registered lightweight command descriptors, only falling back to full extension discovery if the command is unknown. For `channels tui --help`, require only the lightweight TUI channel namespace.","rollback_reason":"./verify.sh --quick failed because `src/com/blockether/vis/internal/main.clj` could not be parsed/formatted; likely delimiter imbalance from editing `-main`. Startup probe itself improved to 4093.1ms before the gate failed.","next_action_hint":"Reapply generic fast-help dispatch with corrected delimiters, run clj-paren-repair if needed, then rerun main-test and verify quick.","startup_ms_observed":4093.1,"user_feedback":"User correctly noted this should be generic for help commands, not just TUI help."}}
