{"run":28,"commit":"2c6e655","metric":80,"metrics":{"pi_quality":0,"vis_quality":111,"pi_seconds":0,"vis_seconds":52,"pi_total_tokens":0,"vis_total_tokens":0,"proof_refs_count":21,"quality_floor_pass":1,"strict_task_win":0,"combined_task_win":0,"suite_combined_win_rate":0},"status":"keep","description":"Add Task 24 migration of persistence audit-bypass fixture off legacy write APIs.","timestamp":1778159957756,"segment":0,"confidence":9.673684210526316,"asi":{"hypothesis":"After foundation tests stopped calling legacy writers, migrate the persistence core audit-bypass fixture from db-prove-gate!/db-fulfill-intent! calls to attested gate setup plus direct legacy intent-row mutation, preserving the audit regression while reducing test dependence on legacy writer APIs.","benchmark_scope":"Implementation-gate proxy while Pi comparison remains blocked by headless GLM timeout; not a Vis-beats-Pi claim.","completed_proof_tasks":["Task 24 persistence audit fixture migration"],"verification":["fresh REPL reload of vis.core/sqlite core","clojure -M:test -n com.blockether.vis.ext.persistance-sqlite.core-test","clojure -M:test -n com.blockether.vis.ext.foundation.introspection-test","task24 grep smoke: persistence core test now has six db-prove-gate! and two db-fulfill-intent! legacy writer mentions remaining, and contains db-attest-gate! plus direct conversation_intent legacy status mutation","./verify.sh --quick"],"trust_boundary":"Persistence audit-bypass regression now bypasses only intent closure attestation through a direct legacy state fixture; gate proof is attestation-backed and no longer exercises legacy proof writer authority.","compatibility_note":"Remaining legacy writer API uses are in persistence core happy-path/idempotency and ref-rejection tests; these should migrate to attestation/evidence-bundle expectations before write APIs are hard-erred or deleted.","next_action_hint":"Task 25: migrate the conversation-intent happy path/idempotency test off db-prove-gate!/db-fulfill-intent! using provenance events, evidence bundles, db-attest-gate!, and db-attest-intent!, then update raw-count expectations."}}
{"run":29,"commit":"2c6e655","metric":0,"metrics":{"pi_quality":0,"vis_quality":0,"pi_seconds":0,"vis_seconds":31,"pi_total_tokens":0,"vis_total_tokens":0,"proof_refs_count":22,"quality_floor_pass":0,"strict_task_win":0,"combined_task_win":0,"suite_combined_win_rate":0},"status":"crash","description":"Task 25 persistence happy-path migration failed on legacy gate-ref count expectation.","timestamp":1778160090449,"segment":0,"confidence":9.673684210526316,"asi":{"hypothesis":"Migrate the conversation-intent happy path/idempotency test from db-prove-gate!/db-fulfill-intent! to provenance events, evidence bundles, db-attest-gate!, and db-attest-intent!.","rollback_reason":"Persistence core test failed because the migrated attestation path leaves conversation_intent_gate_ref at 0 even though the old candidate proof expectation asserted 1; saved patch to target/proof-autoresearch/safety/task25-before-failure-fix.patch before revert.","failure_details":"Lazytest failure at core_test.clj:1133 expected raw-count conversation_intent_gate_ref 1, actual 0. This indicates db-offer-proof! with slots but no legacy proving does not create a gate-ref row in this path, or refs are not authoritative after attestation.","next_action_hint":"Reapply saved patch, update raw-count expectation to 0 or remove candidate proof setup, rerun persistence core/foundation tests and verify quick."}}
{"run":30,"commit":"2c6e655","metric":0,"metrics":{"pi_quality":0,"vis_quality":0,"pi_seconds":0,"vis_seconds":31,"pi_total_tokens":0,"vis_total_tokens":0,"proof_refs_count":22,"quality_floor_pass":0,"strict_task_win":0,"combined_task_win":0,"suite_combined_win_rate":0},"status":"crash","description":"Task 25 persistence happy-path migration retry failed on UUID/string assertion mismatch.","timestamp":1778160172229,"segment":0,"confidence":9.673684210526316,"asi":{"hypothesis":"Reapply Task 25 migration and fix the raw gate-ref count expectation to match attestation path behavior.","rollback_reason":"Persistence core test failed because state-gate proof stores evidence-bundle-id as a string while the bundle row id is a UUID; saved patch to target/proof-autoresearch/safety/task25-before-uuid-fix.patch before revert.","failure_details":"Lazytest failure at core_test.clj:1144 expected UUID but actual was string with the same value.","next_action_hint":"Reapply saved patch, compare (str (:id gate-bundle-again)) to state-gate proof evidence-bundle-id, then rerun persistence core/foundation tests and verify quick."}}
{"run":31,"commit":"74de2c3","metric":70,"metrics":{"pi_quality":0,"vis_quality":112,"pi_seconds":0,"vis_seconds":51,"pi_total_tokens":0,"vis_total_tokens":0,"proof_refs_count":22,"quality_floor_pass":1,"strict_task_win":0,"combined_task_win":0,"suite_combined_win_rate":0},"status":"keep","description":"Add Task 25 migration of persistence conversation-intent happy path to attestations.","timestamp":1778160293737,"segment":0,"confidence":10.322222222222223,"asi":{"hypothesis":"Migrate the persistence conversation-intent happy path/idempotency regression from db-prove-gate!/db-fulfill-intent! to provenance events, evidence bundles, db-attest-gate!, and db-attest-intent!, reducing remaining legacy writer dependence to ref-rejection tests only.","benchmark_scope":"Implementation-gate proxy while Pi comparison remains blocked by headless GLM timeout; not a Vis-beats-Pi claim.","completed_proof_tasks":["Task 25 persistence happy-path migration"],"verification":["fresh REPL reload of vis.core/sqlite core","clojure -M:test -n com.blockether.vis.ext.persistance-sqlite.core-test","clojure -M:test -n com.blockether.vis.ext.foundation.introspection-test","task25 grep smoke: persistence core test now has four db-prove-gate! references and zero db-fulfill-intent! references, while containing db-attest-gate!, db-attest-intent!, and evidence_bundle_member expectations","./verify.sh --quick"],"trust_boundary":"Happy-path persistence lifecycle now uses ledger-derived evidence bundles and accepted attestations as authority. Legacy conversation_intent_ref/gate_ref rows are no longer expected for completion evidence; audit succeeds through attestation rows.","compatibility_note":"Remaining db-prove-gate! uses are ref-validation regressions for compact refs, unobserved canonical refs, running future refs, and timeout refs; db-fulfill-intent! is no longer used by persistence tests.","lessons_learned":["Attestation path leaves conversation_intent_gate_ref at 0 even when a candidate proof was offered; evidence authority lives in evidence_bundle_member.","State-gate proof stores evidence-bundle-id as a string while evidence bundle API returns UUID ids."],"next_action_hint":"Task 26: migrate remaining db-prove-gate! ref-rejection tests to evidence bundle creation/attestation path or move canonical-ref validation to accepted evidence requirements, then hard-error/delete legacy writer APIs."}}
{"run":32,"commit":"74de2c3","metric":0,"metrics":{"pi_quality":0,"vis_quality":0,"pi_seconds":0,"vis_seconds":33,"pi_total_tokens":0,"vis_total_tokens":0,"proof_refs_count":23,"quality_floor_pass":0,"strict_task_win":0,"combined_task_win":0,"suite_combined_win_rate":0},"status":"crash","description":"Task 26 persistence ref-rejection migration failed on compact-ref error-code expectation.","timestamp":1778160578927,"segment":0,"confidence":10.322222222222223,"asi":{"hypothesis":"Migrate remaining persistence core db-prove-gate! ref-rejection tests to evidence-bundle/attestation behavior so persistence tests no longer depend on legacy prove/fulfill writers.","rollback_reason":"Persistence core test failed because compact evidence/from-ref i1.1 is rejected by spec shape first with :invalid-requirement, not by derive-binding's :non-canonical-ref branch. Saved patch to target/proof-autoresearch/safety/task26-before-invalid-requirement-fix.patch before revert.","failure_details":"Lazytest failure at core_test.clj:1220 expected :non-canonical-ref, actual :invalid-requirement.","next_action_hint":"Reapply saved patch, update compact-ref bundle expectation to :invalid-requirement or relax to membership in #{:invalid-requirement :non-canonical-ref}, then rerun persistence/foundation tests and verify quick."}}
{"run":33,"commit":"aa7a6fd","metric":60,"metrics":{"pi_quality":0,"vis_quality":113,"pi_seconds":0,"vis_seconds":55,"pi_total_tokens":0,"vis_total_tokens":0,"proof_refs_count":23,"quality_floor_pass":1,"strict_task_win":0,"combined_task_win":0,"suite_combined_win_rate":0},"status":"keep","description":"Add Task 26 migration of persistence ref-rejection tests off legacy prove writer.","timestamp":1778160669517,"segment":0,"confidence":10.731428571428571,"asi":{"hypothesis":"Migrate remaining persistence core db-prove-gate! ref-rejection tests to evidence-bundle/attestation behavior so persistence tests no longer depend on legacy prove/fulfill writers.","benchmark_scope":"Implementation-gate proxy while Pi comparison remains blocked by headless GLM timeout; not a Vis-beats-Pi claim.","completed_proof_tasks":["Task 26 persistence ref-rejection migration"],"verification":["fresh REPL reload of vis.core/sqlite core","clojure -M:test -n com.blockether.vis.ext.persistance-sqlite.core-test","clojure -M:test -n com.blockether.vis.ext.foundation.introspection-test","task26 grep smoke: persistence core test has zero db-prove-gate! and zero db-fulfill-intent! references; contains compact evidence-bundle rejection, db-attest-gate!, and non-successful-event checks","./verify.sh --quick"],"trust_boundary":"Persistence tests no longer exercise legacy proof/fulfill write authority. Ref invalidity is now represented as rejected evidence bundles or rejected gate attestations, while blocker-compatible timeout evidence still uses the blocker path.","compatibility_note":"The legacy db-prove-gate!/db-fulfill-intent! functions and public exports still exist in source/delegates for external compatibility; internal tests are migrated off them.","lessons_learned":["Compact evidence/from-ref fails evidence requirement spec first, producing :invalid-requirement rather than :non-canonical-ref.","Unobserved canonical refs in db-create-evidence-bundle! currently produce a rejected bundle with :non-successful-event because missing DB rows are represented as placeholder events by ref."],"next_action_hint":"Task 27: hard-error or delete legacy db-prove-gate!/db-fulfill-intent! write authority and remove public core/delegate exports if final grep shows no internal caller still requires them."}}
{"type":"config","name":"Vis cold startup latency with lazy voice extension loading","metricName":"startup_ms","metricUnit":"ms","bestDirection":"lower"}
{"run":34,"commit":"e9c82b0","metric":7871.1,"metrics":{},"status":"keep","description":"Baseline cold bin/vis help startup with all classpath extensions including voice.","timestamp":1778161720214,"segment":1,"confidence":null,"asi":{"hypothesis":"Cold Vis startup is slow because extension discovery loads every extension namespace, including voice namespaces with sherpa/ONNX classes on the classpath. Establish CLI help baseline before changing load path.","benchmark_command":"VIS_CRAC=0 VIS_MEASURE=1 bin/vis help","user_symptom":"TUI/Vis takes too long to load; suspected extension and voice model loading."}}
{"run":35,"commit":"temp-no","metric":0,"metrics":{"startup_ms":325.5},"status":"crash","description":"Temp no-voice classpath probe failed because generated deps.edn was malformed.","timestamp":1778161740069,"segment":1,"confidence":null,"asi":{"hypothesis":"Removing vis-voice from the root classpath should distinguish Clojure/JVM startup from voice dependency or namespace load cost.","rollback_reason":"The temp deps generator removed lines containing vis-voice, leaving malformed EDN in aliases/deps shape; process failed before startup benchmark was meaningful.","next_action_hint":"Use REPL manifest timing and targeted namespace require timing instead of malformed temp deps; or generate a proper minimal deps.edn from deps.edn data."}}
{"run":36,"commit":"temp-no","metric":8137.6,"metrics":{"startup_ms":8137.6},"status":"discard","description":"Temp no-voice classpath probe did not improve cold help startup.","timestamp":1778161766068,"segment":1,"confidence":null,"asi":{"hypothesis":"If voice dependency/classpath presence dominates cold startup, removing com.blockether/vis-voice from deps should make bin/vis help substantially faster.","rollback_reason":"No improvement: temp classpath without voice measured 8137.6ms vs 7871.1ms baseline. Voice dependency presence is not the main cold Clojure startup cost.","next_action_hint":"Optimize actual extension discovery and TUI path; voice model/inference should still be lazily loaded for correctness/headless safety, but it is not the 8s cold CLI bottleneck."}}
{"run":37,"commit":"51ee6a4","metric":7702.6,"metrics":{"startup_ms":7702.6},"status":"keep","description":"Defer voice ASR/input namespace loading until voice status/download or TUI voice hook invocation.","timestamp":1778161868273,"segment":1,"confidence":1,"asi":{"hypothesis":"Voice extension core currently requires ASR/input namespaces during manifest discovery; deferring those with requiring-resolve should reduce extension discovery work and prevent sherpa/ONNX/Java Sound voice paths from loading until first voice use.","verification":["VIS_CRAC=0 VIS_MEASURE=1 bin/vis help","clojure -M:test -n com.blockether.vis.ext.voice.core-test","clojure -M:test -n com.blockether.vis.ext.voice.input-test","./verify.sh --quick"],"result":"Startup improved from 7871.1ms baseline to 7702.6ms. Small but real directionally; measurement still dominated by cold Clojure/JVM and full manifest discovery, not voice models.","user_request":"Defer voice model loading until first use."}}
{"run":38,"commit":"tuihelp","metric":9936.1,"metrics":{"startup_ms":9936.1},"status":"discard","description":"Probe TUI channel help startup after lazy voice core change; not an improvement over current primary baseline.","timestamp":1778161912717,"segment":1,"confidence":0.774712643678161,"asi":{"hypothesis":"TUI channel command help may better represent TUI load path than top-level help and expose channel-specific startup cost.","rollback_reason":"This was a probe using a different, heavier command (bin/vis channels tui --help), so 9936.1ms is not comparable to top-level help and is worse than the active primary metric.","next_action_hint":"Use top-level cold startup as primary for this experiment segment, and treat TUI-help timing as side information; if switching to TUI-specific target, reinitialize experiment with TUI command as baseline.","finding":"TUI channel help main total was ~4651ms vs top-level help ~3166ms, indicating channel path adds startup work beyond manifest discovery."}}
{"run":39,"commit":"statich","metric":9592.6,"metrics":{"startup_ms":9592.6},"status":"checks_failed","description":"Static TUI voice command attempt failed formatting/parse gate.","timestamp":1778161978722,"segment":1,"confidence":0.3873563218390805,"asi":{"hypothesis":"TUI enumerates extension commands during startup; returning a static Ctrl+B command and lazily resolving voice input only when run should avoid loading voice input/ASR during TUI command enumeration.","rollback_reason":"./verify.sh --quick failed because the edited voice core test could not be parsed/formatted; likely delimiter imbalance in the test edit.","next_action_hint":"Reapply the static hook change with a corrected core_test.clj form, run clj-paren-repair if needed, then rerun voice tests and verify quick.","startup_ms_observed":9592.6}}
{"run":40,"commit":"statich","metric":11824.3,"metrics":{"startup_ms":11824.3},"status":"discard","description":"Static TUI voice command avoided parse issue but did not improve top-level cold startup metric.","timestamp":1778162078688,"segment":1,"confidence":0.16319612590799032,"asi":{"hypothesis":"TUI enumerates extension commands during startup; returning a static Ctrl+B command and lazy-resolving voice input only when the command runs should avoid loading voice input/ASR during TUI command enumeration.","rollback_reason":"Top-level bin/vis help startup metric got worse (11824.3ms vs best 7702.6ms/current baseline 7871.1ms). This metric does not exercise TUI command enumeration, so it cannot justify keeping under the current primary benchmark.","next_action_hint":"If optimizing actual TUI startup next, reinitialize autoresearch with a TUI-specific benchmark that invokes channel command enumeration or launches TUI help; then reapply static hook under that target.","verification":["clojure -M:test -n com.blockether.vis.ext.voice.core-test","clojure -M:test -n com.blockether.vis.ext.voice.input-test","./verify.sh --quick"],"finding":"The static hook is functionally correct but not visible in the top-level help benchmark."}}
{"run":41,"commit":"8e85dc5","metric":6381.5,"metrics":{"startup_ms":6381.5},"status":"keep","description":"Skip extension discovery for root-only help requests.","timestamp":1778162235473,"segment":1,"confidence":1.0237800687285226,"asi":{"hypothesis":"Root-level help does not need extension namespaces; skipping discover-all for no-arg/help/--help/-h should cut Vis cold startup without changing real command execution or TUI paths.","verification":["VIS_CRAC=0 VIS_MEASURE=1 bin/vis help","clojure -M:test -n com.blockether.vis.internal.main-test","./verify.sh --quick"],"result":"Startup improved from 7702.6ms best/7871.1ms baseline to 6381.5ms for root help. This removes full extension discovery from root help only; non-root commands still discover extensions before dispatch.","scope":"Optimizes Vis CLI root load. TUI startup still pays extension discovery and needs separate optimization."}}
{"type":"config","name":"Vis TUI channel startup latency","metricName":"tui_startup_ms","metricUnit":"ms","bestDirection":"lower"}
{"run":42,"commit":"tuihelp","metric":0,"metrics":{},"status":"crash","description":"TUI startup baseline run was interrupted before a metric could be captured.","timestamp":1778162262530,"segment":2,"confidence":null,"asi":{"hypothesis":"Switch primary target from root help to TUI channel help because user specifically reports TUI/Vis load latency.","rollback_reason":"run_experiment returned aborted before output/metric capture, so no valid baseline exists for this new TUI startup segment.","next_action_hint":"Rerun TUI startup baseline with the same command and log the parsed tui_startup_ms before applying another code change."}}
{"run":43,"commit":"7aca92d","metric":7670.5,"metrics":{},"status":"keep","description":"Establish valid TUI channel help cold startup baseline after interrupted run.","timestamp":1778162312332,"segment":2,"confidence":null,"asi":{"hypothesis":"Use `bin/vis channels tui --help` as a headless-safe proxy for the TUI command path: it must discover/register the TUI channel without launching Lanterna full-screen.","benchmark_command":"VIS_CRAC=0 VIS_MEASURE=1 bin/vis channels tui --help","result":"Valid baseline captured at 7670.5ms after previous aborted run. JVM main total ~3390ms; shell cold Clojure process ~7628ms.","next_action_hint":"Inspect manifest require timings and reduce work needed before TUI command dispatch, without removing extension functionality from real TUI launch."}}
{"run":44,"commit":"e7c1337","metric":5663.6,"metrics":{},"status":"keep","description":"Defer clojure-lsp namespace loading until z/diagnostics, z/rename-plan, or z/clean-ns-plan is called.","timestamp":1778162432823,"segment":2,"confidence":null,"asi":{"hypothesis":"The Clojure language extension dominates TUI command startup because its aggregator eagerly requires clojure-lsp; exposing lazy wrapper symbols should keep z/diagnostics/rename/clean-ns available while moving the heavy clojure-lsp load to first use.","verification":["VIS_CRAC=0 VIS_MEASURE=1 bin/vis channels tui --help","clojure -M:test -n com.blockether.vis.ext.lang-clojure.core-test","clojure -M:test -n com.blockether.vis.ext.lang-clojure.lsp-test","./verify.sh --quick"],"result":"TUI command help improved from valid 7670.5ms baseline to 5663.6ms. Manifest require for lang-clojure should drop because clojure-lsp no longer loads during extension registration.","not_overfit_reason":"This benefits real Vis/TUI startup too: full extension discovery still registers z/diagnostics etc., but does not pay clojure-lsp class loading unless those tools are used."}}
{"run":45,"commit":"11e0daf","metric":5221.4,"metrics":{},"status":"keep","description":"Split TUI channel registration into a lightweight core namespace and lazy-load full screen runtime only when TUI runs.","timestamp":1778162556370,"segment":2,"confidence":11.807779285391206,"asi":{"hypothesis":"Manifest discovery eagerly requires the heavyweight TUI screen namespace (~500ms). A tiny channel registration namespace can provide the command descriptor and :owns-tty? flag for help/dispatch while requiring the full Lanterna screen only when channel-main runs.","verification":["VIS_CRAC=0 VIS_MEASURE=1 bin/vis channels tui --help","clojure -M:test -n com.blockether.vis.ext.channel-tui.core-test","clojure -M:test -n com.blockether.vis.ext.channel-tui.screen-test","./verify.sh --quick"],"result":"TUI command help improved from 5663.6ms to 5221.4ms; valid original TUI baseline was 7670.5ms.","not_overfit_reason":"This also improves every non-TUI command that performs extension discovery, because the Lanterna screen stack no longer loads unless the TUI channel is actually invoked. TUI invocation still resolves screen/channel-main lazily after stderr redirection."}}
