{"type":"config","name":"Headless Pi vs Vis proof task suite on zai-coding/GLM-5.1","metricName":"vis_loss","metricUnit":"","bestDirection":"lower"}
{"run":1,"commit":"d97ed52","metric":999,"metrics":{"pi_quality":0,"vis_quality":0,"pi_seconds":4.68,"vis_seconds":13.73,"pi_total_tokens":0,"vis_total_tokens":11356,"proof_refs_count":0,"quality_floor_pass":1,"strict_task_win":0,"combined_task_win":0,"suite_combined_win_rate":0},"status":"keep","description":"Start gates passed: Pi smoke, Vis JSON model smoke, verify quick, selected P1/Task 5A.","timestamp":1778152231828,"segment":0,"confidence":null,"asi":{"hypothesis":"Before comparing P1, prove benchmark substrate is fair: same ZAI GLM model available in Pi and Vis, quick repo gate clean, selected P1 guard/gate harness task.","autoresearch_doc_status":"autoresearch.md missing; user explicitly designated PROOF_AUTORESEARCH.md as boss document and forbade extra committed markdown artifacts.","selected_task":"P1 / PROOF.md Task 5A pure guard/gate evidence harness.","start_gate_result":"passed","verify_quick":"passed","artifact_root":"target/proof-autoresearch/start-gates-*","trust_boundary":"extension aggregate/cache/status/checkpoint remain mutable state; only runtime-derived immutable observations may feed evidence."}}
{"run":2,"commit":"cc0540c","metric":998,"metrics":{"pi_quality":0,"vis_quality":0,"pi_seconds":4.64,"vis_seconds":0,"pi_total_tokens":0,"vis_total_tokens":0,"proof_refs_count":0,"quality_floor_pass":1,"strict_task_win":0,"combined_task_win":0,"suite_combined_win_rate":0},"status":"keep","description":"Probe Pi JSON output shape for token extraction before P1 comparison.","timestamp":1778152270005,"segment":0,"confidence":null,"asi":{"hypothesis":"Pi --mode json output may expose usage/tokens directly; need runtime truth before building P1 scorer.","finding":"Probe output did not parse with current fallback and printed numeric-looking chunks; token extraction for Pi should use session/event artifacts or robust fallback, not assume .usage.total_tokens.","artifact_root":"target/proof-autoresearch/pi-json-probe-*","next_action_hint":"Run P1 comparison with full output captured and parse tokens opportunistically; do not block proof comparison solely on missing Pi token field."}}
{"run":3,"commit":"cc0540c","metric":0,"metrics":{"pi_quality":0,"vis_quality":0,"pi_seconds":0,"vis_seconds":0,"pi_total_tokens":0,"vis_total_tokens":0,"proof_refs_count":0,"quality_floor_pass":0,"strict_task_win":0,"combined_task_win":0,"suite_combined_win_rate":0},"status":"crash","description":"P1 comparison harness crashed because isolated PI_CODING_AGENT_DIR lacked ZAI model settings.","timestamp":1778152335544,"segment":0,"confidence":null,"asi":{"hypothesis":"Disposable Pi session directory would keep all runtime artifacts under target while preserving model access.","rollback_reason":"Harness set PI_CODING_AGENT_DIR to target, hiding configured zai-coding model/provider; Pi reported model not found before benchmark ran.","next_action_hint":"Use default PI_CODING_AGENT_DIR with --no-session for Pi benchmark, or copy non-secret settings safely if isolation is needed. Start gate proves provider itself works.","artifact_root":"target/proof-autoresearch/p1-baseline-20260507-131159","failure_class":"harness_isolation_not_provider_outage"}}
{"run":4,"commit":"cc0540c","metric":0,"metrics":{"pi_quality":0,"vis_quality":0,"pi_seconds":300,"vis_seconds":0,"pi_total_tokens":0,"vis_total_tokens":0,"proof_refs_count":0,"quality_floor_pass":0,"strict_task_win":0,"combined_task_win":0,"suite_combined_win_rate":0},"status":"crash","description":"P1 Pi comparison timed out at 300s while still using tools; no completed assistant answer to score.","timestamp":1778154386485,"segment":0,"confidence":null,"asi":{"hypothesis":"Retrying P1 with default Pi config would avoid the provider-isolation crash and produce a fair baseline.","rollback_reason":"Pi headless GLM-5.1 run did not reach final answer within 300s; only partial tool-use transcript existed.","next_action_hint":"Use longer timeout, reduce prompt scope, or implement PROOF.md directly before resuming optimization.","failure_class":"benchmark_timeout_not_provider_failure"}}
{"run":5,"commit":"cc0540c","metric":0,"metrics":{"pi_quality":0,"vis_quality":0,"pi_seconds":600,"vis_seconds":0,"pi_total_tokens":0,"vis_total_tokens":0,"proof_refs_count":0,"quality_floor_pass":0,"strict_task_win":0,"combined_task_win":0,"suite_combined_win_rate":0},"status":"crash","description":"P1 Pi comparison retry timed out at 600s; benchmark blocked by agent runtime latency.","timestamp":1778154393210,"segment":0,"confidence":null,"asi":{"hypothesis":"Increasing the timeout to 600s would let the same P1 Pi comparison complete after provider isolation was fixed.","rollback_reason":"Pi still timed out before final assistant answer; comparison cannot be scored reliably.","next_action_hint":"Pause optimization loop and implement PROOF.md slices directly, then resume autoresearch on smaller completed-task prompts.","failure_class":"benchmark_timeout_not_provider_failure"}}
{"run":6,"commit":"fd22ef9","metric":620,"metrics":{"pi_quality":0,"vis_quality":72,"pi_seconds":0,"vis_seconds":38,"pi_total_tokens":0,"vis_total_tokens":0,"proof_refs_count":3,"quality_floor_pass":1,"strict_task_win":0,"combined_task_win":0,"suite_combined_win_rate":0},"status":"keep","description":"Implement PROOF.md direct proof spine through ledger and evidence bundle derivation before resuming Pi/Vis comparison.","timestamp":1778155903473,"segment":0,"confidence":379,"asi":{"hypothesis":"Because headless Pi comparison timed out, the best next Vis improvement is to implement the missing proof spine directly: canonical proof namespace migration, pure guard/gate harness, immutable provenance_event ledger, and evidence_bundle derivation from runtime events only.","benchmark_scope":"Implementation-gate proxy for original vis_loss while comparison is blocked; this is not a Vis-beats-Pi claim and not a replacement for later suite comparison.","completed_proof_tasks":["Task 3 canonical proof namespace migration","Task 5A pure guard/gate harness","Task 6 provenance_event ledger storage","Task 7 evidence_bundle derivation storage"],"verification":["clojure -M:test -n com.blockether.vis.internal.proof-test","task7 in-memory SQLite smoke for caller slot rejection","./verify.sh --quick"],"trust_boundary":"extension aggregate/cache/status/checkpoint remain mutable state; evidence bundle members are derived from provenance_event payloads and ignore caller-supplied slot values.","next_action_hint":"Implement Task 8 attestation storage/writers so gate proof/impediment require accepted evidence bundles; then rerun smaller Pi/Vis proof prompts."}}
{"run":7,"commit":"fd22ef9","metric":0,"metrics":{"pi_quality":0,"vis_quality":0,"pi_seconds":0,"vis_seconds":34,"pi_total_tokens":0,"vis_total_tokens":0,"proof_refs_count":0,"quality_floor_pass":0,"strict_task_win":0,"combined_task_win":0,"suite_combined_win_rate":0},"status":"checks_failed","description":"Task 8 attestation writer attempt failed quick gate on clj-kondo unused binding.","timestamp":1778156157655,"segment":0,"confidence":379,"asi":{"hypothesis":"Add attestation table and gate-attestation writer requiring accepted evidence bundles.","rollback_reason":"./verify.sh --quick failed with clj-kondo unused binding in SQLite attestation helper.","next_action_hint":"Reapply saved patch target/proof-autoresearch/safety/task8-before-lint-fix.patch, remove unused binding, rerun proof-test + task8 smoke + verify quick.","failure_class":"lint_warning_not_semantic_failure"}}
{"run":8,"commit":"4390241","metric":500,"metrics":{"pi_quality":0,"vis_quality":80,"pi_seconds":0,"vis_seconds":31,"pi_total_tokens":0,"vis_total_tokens":0,"proof_refs_count":5,"quality_floor_pass":1,"strict_task_win":0,"combined_task_win":0,"suite_combined_win_rate":0},"status":"keep","description":"Add Task 8 attestation storage and gate attestation writer requiring accepted evidence bundles.","timestamp":1778156246938,"segment":0,"confidence":2.633245382585752,"asi":{"hypothesis":"Now that ledger events and evidence bundles exist, the highest-leverage next proof improvement is the decision layer: persist attestations and make gate proof/impediment depend on accepted evidence bundles rather than old proof blobs.","benchmark_scope":"Implementation-gate proxy while Pi comparison remains blocked by headless GLM timeout; not a Vis-beats-Pi claim.","completed_proof_tasks":["Task 8 attestation storage/writers"],"verification":["clojure -M:test -n com.blockether.vis.internal.proof-test","task8 in-memory SQLite smoke: rejected bundle cannot attest, accepted bundle writes gate/proven attestation","./verify.sh --quick"],"trust_boundary":"attestation rows decide over accepted evidence_bundle rows only; rejected bundles throw; legacy gate proof blob is written only as an attestation-derived projection, not authority.","previous_failed_run":"Run 7 failed only on clj-kondo unused binding; fixed by removing unused binding and normalizing kind before rerun.","next_action_hint":"Implement Task 9 plan completion transition from accepted gate attestations while keeping intent fulfillment separate."}}
{"run":9,"commit":"4390241","metric":0,"metrics":{"pi_quality":0,"vis_quality":0,"pi_seconds":0,"vis_seconds":20,"pi_total_tokens":0,"vis_total_tokens":0,"proof_refs_count":0,"quality_floor_pass":0,"strict_task_win":0,"combined_task_win":0,"suite_combined_win_rate":0},"status":"crash","description":"Task 9 plan completion attempt failed smoke assertion after first gate attestation.","timestamp":1778156456164,"segment":0,"confidence":2.633245382585752,"asi":{"hypothesis":"After Task 8, add plan completion transition so all required gate attestations complete the plan while intent remains active.","rollback_reason":"Task9 smoke expected plan to remain active after one of two gates, but runtime projection did not match test path; need inspect db-intents shape/status ordering or underlying plan transition.","next_action_hint":"Reapply target/proof-autoresearch/safety/task9-before-smoke-fix.patch, inspect state1 from db-intents/raw DB after first gate, then fix either test assertion or plan transition.","failure_class":"smoke_assertion_not_verify_failure"}}
{"run":10,"commit":"8583e24","metric":420,"metrics":{"pi_quality":0,"vis_quality":86,"pi_seconds":0,"vis_seconds":28,"pi_total_tokens":0,"vis_total_tokens":0,"proof_refs_count":6,"quality_floor_pass":1,"strict_task_win":0,"combined_task_win":0,"suite_combined_win_rate":0},"status":"keep","description":"Add Task 9 plan completion transition from accepted gate attestations while leaving intent active.","timestamp":1778156530112,"segment":0,"confidence":2.895,"asi":{"hypothesis":"After gate attestations exist, the next trust improvement is plan-level lifecycle: complete a plan only after all required gates have accepted proof attestations, and do not fulfill the user intent automatically.","benchmark_scope":"Implementation-gate proxy while Pi comparison remains blocked by headless GLM timeout; not a Vis-beats-Pi claim.","completed_proof_tasks":["Task 9 plan completion transition"],"verification":["fresh REPL reload of vis.core/internal.persistance/sqlite core","clojure -M:test -n com.blockether.vis.internal.proof-test","task9 in-memory SQLite smoke: one of two gates leaves plan active, two of two completes plan, intent remains active","./verify.sh --quick"],"trust_boundary":"Plan completion derives from gate statuses written by accepted gate attestations; intent fulfillment remains a separate future closure boundary.","previous_failed_run":"Run 9 failed because smoke inspected wrong db-intents path (:plans top-level instead of nested under intent); runtime raw plan state was correct after one gate.","next_action_hint":"Implement Task 10 intent closure attestation/evidence rules: fulfillment should require completed plan and accepted closure attestation; abandonment should require blocker/impediment evidence."}}
{"run":11,"commit":"658b1e4","metric":350,"metrics":{"pi_quality":0,"vis_quality":91,"pi_seconds":0,"vis_seconds":29,"pi_total_tokens":0,"vis_total_tokens":0,"proof_refs_count":7,"quality_floor_pass":1,"strict_task_win":0,"combined_task_win":0,"suite_combined_win_rate":0},"status":"keep","description":"Add Task 10 intent closure attestation requiring accepted closure evidence and completed plan.","timestamp":1778156805568,"segment":0,"confidence":3.7085714285714286,"asi":{"hypothesis":"After plan completion exists, close the user commitment boundary with intent-level attestations: fulfillment must consume an accepted closure evidence bundle and require a completed plan, so early closure over open gates remains blocked.","benchmark_scope":"Implementation-gate proxy while Pi comparison remains blocked by headless GLM timeout; not a Vis-beats-Pi claim.","completed_proof_tasks":["Task 10 intent closure attestation path"],"verification":["fresh REPL reload of vis.core/internal.persistance/sqlite core","clojure -M:test -n com.blockether.vis.internal.proof-test","task10 in-memory SQLite smoke: accepted closure bundle before completed plan throws and leaves intent active; accepted gate attestation completes plan; accepted intent/fulfilled attestation fulfills intent","./verify.sh --quick"],"trust_boundary":"Intent fulfillment can now be represented as an accepted attestation over an accepted closure evidence bundle, and the attestation writer refuses fulfillment unless the plan is completed.","compatibility_note":"Existing legacy fulfill/abandon APIs remain during migration; new intent attestation writer establishes the authoritative closure path for audit migration.","next_action_hint":"Implement Task 11 audit surface over ledger, evidence bundles, attestations, gates, plans, and intents; report missing/early/bypassed closure attestations."}}
{"run":12,"commit":"9e67464","metric":300,"metrics":{"pi_quality":0,"vis_quality":95,"pi_seconds":0,"vis_seconds":29,"pi_total_tokens":0,"vis_total_tokens":0,"proof_refs_count":8,"quality_floor_pass":1,"strict_task_win":0,"combined_task_win":0,"suite_combined_win_rate":0},"status":"keep","description":"Add Task 11 proof audit surface over accepted attestations and entity lifecycle state.","timestamp":1778156965549,"segment":0,"confidence":4.66,"asi":{"hypothesis":"After intent closure attestations exist, the next trust improvement is a read-only audit surface that validates entity lifecycle state against accepted attestations and reports legacy/bypassed closure paths.","benchmark_scope":"Implementation-gate proxy while Pi comparison remains blocked by headless GLM timeout; not a Vis-beats-Pi claim.","completed_proof_tasks":["Task 11 audit surface"],"verification":["fresh REPL reload of vis.core/internal.persistance/sqlite core","clojure -M:test -n com.blockether.vis.internal.proof-test","task11 in-memory SQLite smoke: attested gate+intent closure audits clean; legacy db-prove/db-fulfill path reports missing intent closure attestation","./verify.sh --quick"],"trust_boundary":"db-audit-proof is read-only and checks proven/impeded gates, completed/abandoned plans, and fulfilled/abandoned intents against accepted attestations and aggregate state.","compatibility_note":"Legacy proof/fulfill APIs still exist during migration, but audit now detects fulfilled intents without accepted intent/fulfilled attestations.","next_action_hint":"Implement Task 12 audit/attestation rendering and/or extension lifecycle hooks so channels and extensions consume the audit surface instead of scraping proof prose."}}
{"run":13,"commit":"1ba1833","metric":260,"metrics":{"pi_quality":0,"vis_quality":98,"pi_seconds":0,"vis_seconds":42,"pi_total_tokens":0,"vis_total_tokens":0,"proof_refs_count":9,"quality_floor_pass":1,"strict_task_win":0,"combined_task_win":0,"suite_combined_win_rate":0},"status":"keep","description":"Add Task 12 proof-audit rendering to v/audit-report.","timestamp":1778157141121,"segment":0,"confidence":4.61875,"asi":{"hypothesis":"After the audit surface exists, expose it through the existing audit-report rendering path so humans, channels, and future extension hooks can consume attestation-ledger failures without scraping proof prose.","benchmark_scope":"Implementation-gate proxy while Pi comparison remains blocked by headless GLM timeout; not a Vis-beats-Pi claim.","completed_proof_tasks":["Task 12 audit rendering"],"verification":["fresh REPL reload of vis.core/internal.persistance/sqlite core/foundation introspection","clojure -M:test -n com.blockether.vis.internal.proof-test","clojure -M:test -n com.blockether.vis.ext.foundation.introspection-test","task12 in-memory SQLite smoke: legacy closure audit-report renders Proof audit, needs-work status, and missing intent closure attestation","./verify.sh --quick"],"trust_boundary":"v/audit-report now renders db-audit-proof output directly; validation truth remains in persisted ledger/bundle/attestation state, not markdown text.","compatibility_note":"No new proof authority added; this is a projection of the Task 11 read-only audit surface alongside the existing provenance report.","next_action_hint":"Implement Task 13 structured proof lifecycle hooks for event-appended, evidence-bundle-created, attestation-accepted, and audit-violation notifications."}}
{"run":14,"commit":"0c75940","metric":230,"metrics":{"pi_quality":0,"vis_quality":100,"pi_seconds":0,"vis_seconds":40,"pi_total_tokens":0,"vis_total_tokens":0,"proof_refs_count":10,"quality_floor_pass":1,"strict_task_win":0,"combined_task_win":0,"suite_combined_win_rate":0},"status":"keep","description":"Add Task 13 structured proof lifecycle hooks for extensions.","timestamp":1778157427655,"segment":0,"confidence":4.80625,"asi":{"hypothesis":"After audit rendering exists, expose structured proof lifecycle events so extensions can observe ledger/bundle/attestation/audit transitions directly instead of scraping reports or prompt prose.","benchmark_scope":"Implementation-gate proxy while Pi comparison remains blocked by headless GLM timeout; not a Vis-beats-Pi claim.","completed_proof_tasks":["Task 13 structured proof lifecycle hooks"],"verification":["fresh REPL reload of vis.core/internal.extension/internal.persistance/sqlite core","clojure -M:test -n com.blockether.vis.internal.extension-test","clojure -M:test -n com.blockether.vis.internal.proof-test","task13 in-memory SQLite smoke: registered extension observed proof/event-appended, proof/evidence-bundle-created, proof/attestation-accepted, and proof/audit-violation","./verify.sh --quick"],"trust_boundary":"Hooks are notifications only: listener failures are logged and swallowed, and proof authority remains in persisted provenance_event, evidence_bundle, attestation, and audit state.","compatibility_note":"Added optional :ext/on-proof-event-fn and host emit-proof-event!; existing extensions are unaffected because the hook is optional.","next_action_hint":"Start Task 14 cleanup: migrate callers from legacy proof/prove/fulfill surfaces toward audit/attestation names, then remove stale proof semantics only after regression coverage is complete."}}
{"run":15,"commit":"2c44275","metric":210,"metrics":{"pi_quality":0,"vis_quality":101,"pi_seconds":0,"vis_seconds":42,"pi_total_tokens":0,"vis_total_tokens":0,"proof_refs_count":11,"quality_floor_pass":1,"strict_task_win":0,"combined_task_win":0,"suite_combined_win_rate":0},"status":"keep","description":"Add Task 14 model-facing v/audit data surface and migrate prompt away from legacy proof-checks.","timestamp":1778157592842,"segment":0,"confidence":5.635714285714286,"asi":{"hypothesis":"After audit rendering and proof lifecycle hooks exist, the next cleanup slice is migrating the model-facing surface from legacy proof-check prose toward persisted audit data: add v/audit over db-audit-proof and tell the prompt to gate normal answers on (:success? (v/audit)).","benchmark_scope":"Implementation-gate proxy while Pi comparison remains blocked by headless GLM timeout; not a Vis-beats-Pi claim.","completed_proof_tasks":["Task 14 audit API migration"],"verification":["fresh REPL reload of vis.core/sqlite core/foundation introspection","clojure -M:test -n com.blockether.vis.ext.foundation.introspection-test","clojure -M:test -n com.blockether.vis.internal.proof-test","task14 in-memory SQLite smoke: v/audit detects legacy closure bypass and v/audit-report renders needs-work proof audit","./verify.sh --quick"],"trust_boundary":"v/audit returns db-audit-proof data directly; markdown remains projection-only via v/audit-report, and legacy proof-checks is demoted to gate-detail compatibility.","compatibility_note":"Existing v/proof-checks and v/proofs remain for compatibility; prompt now marks proof-checks as legacy detail and names v/audit as the normal-answer gate.","next_action_hint":"Task 15: remove or hard-deprecate legacy prove/fulfill proof authority surfaces after adding attestation-backed v/ helpers or compatibility wrappers that call db-attest-gate!/db-attest-intent!."}}
