{"run":16,"commit":"7b575db","metric":190,"metrics":{"pi_quality":0,"vis_quality":102,"pi_seconds":0,"vis_seconds":42,"pi_total_tokens":0,"vis_total_tokens":0,"proof_refs_count":12,"quality_floor_pass":1,"strict_task_win":0,"combined_task_win":0,"suite_combined_win_rate":0},"status":"keep","description":"Add Task 15 attestation-backed v/attest-gate! and v/attest-intent! helpers.","timestamp":1778158184579,"segment":0,"confidence":5.7785714285714285,"asi":{"hypothesis":"After v/audit became the model-facing validation gate, add attestation-backed v/ helpers so callers can migrate away from legacy prove/fulfill writers without hand-building bundle IDs: v/attest-gate! and v/attest-intent! derive accepted evidence bundles from provenance_event requirements and then write attestations.","benchmark_scope":"Implementation-gate proxy while Pi comparison remains blocked by headless GLM timeout; not a Vis-beats-Pi claim.","completed_proof_tasks":["Task 15 attestation helper migration"],"verification":["fresh REPL reload of vis.core/sqlite core/foundation introspection","clojure -M:test -n com.blockether.vis.ext.foundation.introspection-test","clojure -M:test -n com.blockether.vis.internal.proof-test","task15 in-memory SQLite smoke: v/attest-gate! completes plan from accepted evidence bundle, v/attest-intent! fulfills intent, v/audit succeeds with two attestations","./verify.sh --quick"],"trust_boundary":"Helpers require explicit :requirements or an existing :evidence-bundle-id; they do not accept caller-supplied proof slot values as authority. Authority remains provenance_event -> evidence_bundle -> attestation -> audit.","compatibility_note":"Legacy v/prove-gate! and v/fulfill-intent! remain but are documented as compatibility-only; prompt now names v/attest-gate! and v/attest-intent! as preferred resolution path.","next_action_hint":"Task 16: hard-deprecate or remove legacy proof-check/proofs/prove/fulfill authority surfaces after adding any required compatibility wrappers and updating tests that still rely on legacy APIs."}}
{"run":17,"commit":"822ebed","metric":175,"metrics":{"pi_quality":0,"vis_quality":103,"pi_seconds":0,"vis_seconds":49,"pi_total_tokens":0,"vis_total_tokens":0,"proof_refs_count":13,"quality_floor_pass":1,"strict_task_win":0,"combined_task_win":0,"suite_combined_win_rate":0},"status":"keep","description":"Add Task 16 core prompt hard-deprecation of legacy prove/fulfill proof authority.","timestamp":1778158377116,"segment":0,"confidence":6.592,"asi":{"hypothesis":"After attestation-backed v/ helpers exist, remove legacy prove/fulfill authority from the model-facing core prompt so new runs use v/attest-gate!, v/attest-intent!, and v/audit as the normal proof path while compatibility functions remain callable for existing code.","benchmark_scope":"Implementation-gate proxy while Pi comparison remains blocked by headless GLM timeout; not a Vis-beats-Pi claim.","completed_proof_tasks":["Task 16 prompt hard-deprecation of legacy proof authority"],"verification":["fresh REPL reload of vis.core/internal.prompt/foundation introspection","clojure -M:test -n com.blockether.vis.internal.prompt-test","clojure -M:test -n com.blockether.vis.ext.foundation.introspection-test","clojure -M:test -n com.blockether.vis.internal.proof-test","task16 prompt smoke: CORE_SYSTEM_PROMPT contains v/attest-gate!, v/attest-intent!, v/audit and no v/prove-gate!/v/fulfill-intent!","./verify.sh --quick"],"trust_boundary":"Core prompt now teaches the persisted audit/attestation path; markdown/proof-check prose is not authority. Legacy writers still exist only for compatibility and tests until deletion is safe.","compatibility_note":"Did not remove db-prove-gate!, db-fulfill-intent!, v/prove-gate!, or v/fulfill-intent! yet; this slice only removes them from the core model instruction path.","next_action_hint":"Task 17: migrate loop runtime proof appendix from legacy proof-checks/proofs to v/audit/audit-report or remove automatic <proofs> appending after audit report coverage is complete."}}
{"run":18,"commit":"822ebed","metric":0,"metrics":{"pi_quality":0,"vis_quality":0,"pi_seconds":0,"vis_seconds":39,"pi_total_tokens":0,"vis_total_tokens":0,"proof_refs_count":0,"quality_floor_pass":0,"strict_task_win":0,"combined_task_win":0,"suite_combined_win_rate":0},"status":"crash","description":"Task 17 runtime audit appendix attempt failed only in ad-hoc smoke command syntax after tests passed.","timestamp":1778158617141,"segment":0,"confidence":6.592,"asi":{"hypothesis":"Migrate runtime final-answer appendix from legacy proof-checks/proofs to audit/audit-report so automatic append uses persisted audit authority.","rollback_reason":"run_experiment failed after the targeted test suites passed because the ad-hoc clojure -M -e smoke used invalid private var syntax for with-redefs, not because the code/test change failed.","next_action_hint":"Reapply target/proof-autoresearch/safety/task17-before-smoke-fix.patch and rerun with a simpler smoke that calls append-runtime-proofs via with-redefs-fn or omits the private-var smoke since loop-test covers it.","failure_class":"bad_smoke_command"}}
{"run":19,"commit":"1280995","metric":160,"metrics":{"pi_quality":0,"vis_quality":104,"pi_seconds":0,"vis_seconds":48,"pi_total_tokens":0,"vis_total_tokens":0,"proof_refs_count":14,"quality_floor_pass":1,"strict_task_win":0,"combined_task_win":0,"suite_combined_win_rate":0},"status":"keep","description":"Add Task 17 runtime proof appendix migration to persisted audit report.","timestamp":1778158692421,"segment":0,"confidence":6.991666666666666,"asi":{"hypothesis":"After the core prompt moved to audit/attestation, migrate runtime final-answer appendix from legacy foundation-proof-checks/foundation-proofs to foundation-audit/foundation-audit-report so automatic append uses persisted audit authority and no longer depends on legacy <proofs>.","benchmark_scope":"Implementation-gate proxy while Pi comparison remains blocked by headless GLM timeout; not a Vis-beats-Pi claim.","completed_proof_tasks":["Task 17 runtime audit appendix"],"verification":["fresh REPL reload of vis.core/internal.loop/foundation introspection","clojure -M:test -n com.blockether.vis.internal.loop-test","clojure -M:test -n com.blockether.vis.ext.foundation.introspection-test","clojure -M:test -n com.blockether.vis.internal.proof-test","task17 runtime smoke: append-runtime-proofs appends Proof audit, avoids duplicate Proof audit, and skips needs-input answers","./verify.sh --quick"],"trust_boundary":"Automatic answer appendix now renders db-audit-proof via foundation-audit-report only when persisted audit succeeds and there is at least one attestation; empty/no-db audits do not append misleading success reports.","previous_failed_run":"Run 18 failed only because the ad-hoc smoke used invalid private var syntax; targeted tests had already passed. Rerun used corrected with-redefs-fn smoke.","compatibility_note":"Function name append-runtime-proofs remains for compatibility, but implementation now uses proof audit rather than legacy proof-checks/proofs.","next_action_hint":"Task 18: remove public v/proof-checks and v/proofs symbols from all-symbols/prompt once tests move to v/audit/audit-report; keep private helpers only if still needed for regression diagnostics."}}
{"run":20,"commit":"7a298d2","metric":145,"metrics":{"pi_quality":0,"vis_quality":105,"pi_seconds":0,"vis_seconds":35,"pi_total_tokens":0,"vis_total_tokens":0,"proof_refs_count":15,"quality_floor_pass":1,"strict_task_win":0,"combined_task_win":0,"suite_combined_win_rate":0},"status":"keep","description":"Add Task 18 removal of public v/proof-checks and v/proofs symbols from foundation prompt surface.","timestamp":1778158857073,"segment":0,"confidence":7.591111111111111,"asi":{"hypothesis":"After runtime answer appending moved to persisted audit, remove public v/proof-checks and v/proofs from the foundation sandbox/prompt surface so models and extensions no longer use legacy proof-check/proofs APIs for authority.","benchmark_scope":"Implementation-gate proxy while Pi comparison remains blocked by headless GLM timeout; not a Vis-beats-Pi claim.","completed_proof_tasks":["Task 18 public proof-checks/proofs removal"],"verification":["fresh REPL reload of vis.core/foundation introspection","clojure -M:test -n com.blockether.vis.ext.foundation.introspection-test","clojure -M:test -n com.blockether.vis.internal.proof-test","task18 symbol smoke: all-symbols excludes proof-checks/proofs, introspection prompt excludes v/proof-checks/v/proofs, and prompt still includes v/audit and v/attest-gate!","./verify.sh --quick"],"trust_boundary":"Public model-facing validation now routes through v/audit and v/audit-report; old foundation-proof-checks/foundation-proofs remain private diagnostic helpers for regression tests only.","compatibility_note":"Did not delete private foundation-proof-checks/foundation-proofs or legacy v/prove-gate!/v/fulfill-intent! yet; public symbol exports for proof-checks/proofs are gone.","next_action_hint":"Task 19: remove or hard-error public legacy v/prove-gate! and v/fulfill-intent! after migrating loop/foundation tests to v/attest-gate! and v/attest-intent!."}}
{"run":21,"commit":"7a298d2","metric":0,"metrics":{"pi_quality":0,"vis_quality":0,"pi_seconds":0,"vis_seconds":27,"pi_total_tokens":0,"vis_total_tokens":0,"proof_refs_count":0,"quality_floor_pass":0,"strict_task_win":0,"combined_task_win":0,"suite_combined_win_rate":0},"status":"crash","description":"Task 19 public prove/fulfill removal failed only in ad-hoc smoke null meta check after target tests passed.","timestamp":1778158988884,"segment":0,"confidence":7.591111111111111,"asi":{"hypothesis":"Remove public v/prove-gate! and v/fulfill-intent! exports after attestation helpers are available, leaving private compatibility helpers for internal tests.","rollback_reason":"The run failed after foundation introspection and proof tests passed because the ad-hoc smoke called .contains on nil var metadata, not due to code/test failure.","next_action_hint":"Reapply target/proof-autoresearch/safety/task19-before-smoke-fix.patch and rerun with a simpler symbol-only smoke over intro/all-symbols.","failure_class":"bad_smoke_command"}}
{"run":22,"commit":"7a298d2","metric":0,"metrics":{"pi_quality":0,"vis_quality":0,"pi_seconds":0,"vis_seconds":36,"pi_total_tokens":0,"vis_total_tokens":0,"proof_refs_count":0,"quality_floor_pass":0,"strict_task_win":0,"combined_task_win":0,"suite_combined_win_rate":0},"status":"checks_failed","description":"Task 19 public prove/fulfill removal hit clj-kondo unused private warnings for retained compatibility helpers.","timestamp":1778159048427,"segment":0,"confidence":7.591111111111111,"asi":{"hypothesis":"Remove public v/prove-gate! and v/fulfill-intent! exports while retaining compatibility helpers.","rollback_reason":"./verify.sh --quick failed because retained private foundation-prove-gate! and foundation-fulfill-intent! are no longer referenced by all-symbols, producing clj-kondo unused private warnings.","next_action_hint":"Reapply target/proof-autoresearch/safety/task19-before-smoke-fix.patch, convert retained compatibility helpers from defn- to defn (or otherwise suppress unused-private warnings), then rerun foundation/proof tests and verify quick.","failure_class":"lint_unused_private_compat_helpers"}}
{"run":23,"commit":"55d0007","metric":132,"metrics":{"pi_quality":0,"vis_quality":106,"pi_seconds":0,"vis_seconds":35,"pi_total_tokens":0,"vis_total_tokens":0,"proof_refs_count":16,"quality_floor_pass":1,"strict_task_win":0,"combined_task_win":0,"suite_combined_win_rate":0},"status":"keep","description":"Add Task 19 removal of public v/prove-gate! and v/fulfill-intent! symbols.","timestamp":1778159117818,"segment":0,"confidence":8.67,"asi":{"hypothesis":"After public proof-checks/proofs are gone, remove public v/prove-gate! and v/fulfill-intent! exports so model-facing resolution is only v/attest-gate!/v/attest-intent!, while retaining non-sandbox compatibility helpers for old internal tests and callers.","benchmark_scope":"Implementation-gate proxy while Pi comparison remains blocked by headless GLM timeout; not a Vis-beats-Pi claim.","completed_proof_tasks":["Task 19 public prove/fulfill removal"],"verification":["fresh REPL reload of vis.core/foundation introspection","clojure -M:test -n com.blockether.vis.ext.foundation.introspection-test","clojure -M:test -n com.blockether.vis.internal.proof-test","task19 symbol smoke: all-symbols includes attest-gate!/attest-intent! and excludes prove-gate!/fulfill-intent!","./verify.sh --quick"],"trust_boundary":"Sandbox/model-facing resolution now routes through attestation helpers; retained foundation-prove-gate! and foundation-fulfill-intent! are non-exported compatibility functions only.","previous_failed_runs":"Run 21 failed due bad smoke nil metadata check; Run 22 failed lint because retained helpers were private and no longer referenced by all-symbols. Fixed by keeping them public-at-namespace but not sandbox-exported.","compatibility_note":"db-prove-gate!, db-fulfill-intent!, and namespace functions foundation-prove-gate!/foundation-fulfill-intent! still exist for old host/internal calls, but v/ sandbox no longer exports them.","next_action_hint":"Task 20: migrate internal tests/callers off db-prove-gate!/db-fulfill-intent!, then hard-error or delete legacy write authority."}}
{"run":24,"commit":"30898a0","metric":120,"metrics":{"pi_quality":0,"vis_quality":107,"pi_seconds":0,"vis_seconds":32,"pi_total_tokens":0,"vis_total_tokens":0,"proof_refs_count":17,"quality_floor_pass":1,"strict_task_win":0,"combined_task_win":0,"suite_combined_win_rate":0},"status":"keep","description":"Add Task 20 migration of loop final-answer tests from legacy proof writes to attestations.","timestamp":1778159296968,"segment":0,"confidence":8.575609756097561,"asi":{"hypothesis":"Before deleting legacy db-prove-gate!/db-fulfill-intent! write authority, migrate internal loop final-answer gate tests/callers to the authoritative path: provenance_event -> evidence_bundle -> gate/intent attestation -> audit.","benchmark_scope":"Implementation-gate proxy while Pi comparison remains blocked by headless GLM timeout; not a Vis-beats-Pi claim.","completed_proof_tasks":["Task 20 loop test/caller migration"],"verification":["fresh REPL reload of vis.core/sqlite core/internal.loop","clojure -M:test -n com.blockether.vis.internal.loop-test","clojure -M:test -n com.blockether.vis.internal.proof-test","task20 smoke: loop_test contains db-attest-gate!/db-attest-intent! and no db-prove-gate!/db-fulfill-intent!","./verify.sh --quick"],"trust_boundary":"Loop final-answer acceptance tests now construct accepted evidence bundles and attestations; they no longer prove/fulfill via legacy proof blobs/refs.","compatibility_note":"Legacy write authority remains for foundation/persistence tests and old callers; this slice removes loop-test dependency only.","next_action_hint":"Task 21: migrate foundation introspection tests off foundation-prove-gate!/foundation-fulfill-intent!, then remove namespace compatibility helpers or make them hard-error."}}
{"run":25,"commit":"e8c0cda","metric":110,"metrics":{"pi_quality":0,"vis_quality":108,"pi_seconds":0,"vis_seconds":34,"pi_total_tokens":0,"vis_total_tokens":0,"proof_refs_count":18,"quality_floor_pass":1,"strict_task_win":0,"combined_task_win":0,"suite_combined_win_rate":0},"status":"keep","description":"Add Task 21 foundation introspection test migration slice from legacy helpers to attestations.","timestamp":1778159506595,"segment":0,"confidence":9.071428571428571,"asi":{"hypothesis":"After loop tests no longer depend on legacy proof writes, migrate foundation introspection tests that exercise normal resolution and compact-ref rejection onto v/attest-gate!/v/attest-intent! so remaining legacy helper usage is isolated to private proof-check diagnostic regressions.","benchmark_scope":"Implementation-gate proxy while Pi comparison remains blocked by headless GLM timeout; not a Vis-beats-Pi claim.","completed_proof_tasks":["Task 21 foundation introspection test migration slice"],"verification":["fresh REPL reload of vis.core/sqlite core/foundation introspection","clojure -M:test -n com.blockether.vis.ext.foundation.introspection-test","clojure -M:test -n com.blockether.vis.internal.proof-test","task21 grep smoke: foundation introspection test now has exactly two foundation-prove-gate! and two foundation-fulfill-intent! occurrences, both confined to remaining private proof-check diagnostic tests, and includes attest-gate!/attest-intent!","./verify.sh --quick"],"trust_boundary":"Normal foundation intent resolution tests now use provenance_event -> evidence_bundle -> gate/intent attestation; legacy helper use no longer represents the mainline resolution path.","compatibility_note":"Remaining foundation-prove-gate!/foundation-fulfill-intent! uses are private proof-check diagnostic regressions that intentionally exercise old proof blob validation; not public sandbox surface.","next_action_hint":"Task 22: either rewrite private proof-check diagnostic regressions as explicit legacy fixtures without helper calls or delete proof-check diagnostics entirely, then hard-error/delete legacy db-prove-gate!/db-fulfill-intent! write paths."}}
{"run":26,"commit":"aec08a7","metric":100,"metrics":{"pi_quality":0,"vis_quality":109,"pi_seconds":0,"vis_seconds":32,"pi_total_tokens":0,"vis_total_tokens":0,"proof_refs_count":19,"quality_floor_pass":1,"strict_task_win":0,"combined_task_win":0,"suite_combined_win_rate":0},"status":"keep","description":"Add Task 22 cleanup removing remaining foundation legacy helper calls from tests.","timestamp":1778159669664,"segment":0,"confidence":9.563829787234043,"asi":{"hypothesis":"After normal foundation tests migrated to attestations, remove the remaining private proof-check/proofs diagnostics that still call foundation-prove-gate!/foundation-fulfill-intent!, since those public symbols are gone and the runtime appendix now uses audit.","benchmark_scope":"Implementation-gate proxy while Pi comparison remains blocked by headless GLM timeout; not a Vis-beats-Pi claim.","completed_proof_tasks":["Task 22 private proof-check helper cleanup"],"verification":["fresh REPL reload of vis.core/foundation introspection","clojure -M:test -n com.blockether.vis.ext.foundation.introspection-test","clojure -M:test -n com.blockether.vis.internal.proof-test","task22 grep smoke: zero foundation-prove-gate!/foundation-fulfill-intent! calls remain in foundation tests; exactly one db-prove-gate!/db-fulfill-intent! legacy audit-bypass fixture remains","./verify.sh --quick"],"trust_boundary":"Foundation tests no longer use namespace compatibility prove/fulfill helpers. The only remaining foundation legacy write usage is an explicit audit-bypass fixture that proves db-audit-proof detects old closure writes.","compatibility_note":"Private foundation-proof-checks/foundation-proofs functions still exist but are no longer public symbols and no longer have success/rendering tests that depend on legacy helper calls.","next_action_hint":"Task 23: replace the remaining legacy audit-bypass fixture with direct legacy-row setup or migration fixture, then hard-error/delete db-prove-gate!/db-fulfill-intent!."}}
{"run":27,"commit":"11a4250","metric":90,"metrics":{"pi_quality":0,"vis_quality":110,"pi_seconds":0,"vis_seconds":32,"pi_total_tokens":0,"vis_total_tokens":0,"proof_refs_count":20,"quality_floor_pass":1,"strict_task_win":0,"combined_task_win":0,"suite_combined_win_rate":0},"status":"keep","description":"Add Task 23 migration of foundation legacy audit-bypass fixture off legacy write APIs.","timestamp":1778159801002,"segment":0,"confidence":10.1,"asi":{"hypothesis":"After deleting private proof-check helper tests, replace the remaining foundation audit-bypass fixture's db-prove-gate!/db-fulfill-intent! calls with attested gate setup plus direct legacy intent-row mutation, so foundation tests no longer exercise legacy writer APIs while still proving audit detects legacy closure bypass.","benchmark_scope":"Implementation-gate proxy while Pi comparison remains blocked by headless GLM timeout; not a Vis-beats-Pi claim.","completed_proof_tasks":["Task 23 foundation legacy audit fixture migration"],"verification":["fresh REPL reload of vis.core/sqlite core/foundation introspection","clojure -M:test -n com.blockether.vis.ext.foundation.introspection-test","clojure -M:test -n com.blockether.vis.internal.proof-test","task23 grep smoke: foundation introspection test has no db-prove-gate!/db-fulfill-intent!/foundation-prove-gate!/foundation-fulfill-intent!, but still contains db-attest-gate! and direct conversation_intent legacy status mutation","./verify.sh --quick"],"trust_boundary":"Foundation audit-bypass regression now bypasses only intent closure attestation via direct legacy row mutation; gate proof remains attestation-backed. This isolates the legacy state shape without calling legacy writer APIs.","compatibility_note":"Legacy writer APIs still exist because persistence core tests and old host callers may use them; foundation tests are fully migrated off them.","next_action_hint":"Task 24: migrate persistence core tests off db-prove-gate!/db-fulfill-intent!, starting with the conversation-intent-test happy path, then hard-error/delete legacy write authority."}}
